name,ingredients,diet,flavor_profile,state,region
Pineapple rice recipe,"½ cup rice ( (any non sticky variety)) 1 to 2 tbsp butter ( or oil) ¾ tbsp garlic (chopped ) 8 to 10 cashews ( split) raisins ( as desired) ½ cup spring onions ( and capsicum / bell peppers) 1 green chili ( slit (less spicy variety, skip for kids)) ¼ to ½ tsp curry powder ( (optional) (for kids 1/4 tsp works good)) 2 tsp soya sauce 1 tsp vinegar salt ( as needed) 1 cup pineapple (chunks) 1 tbsp coriander leaves ( / cilantro (chopped), fresh ) oil (little more ) ",vegetarian,spicy,-1,Indo-chinese
Garlic paneer recipe,1 ¼ cup paneer ( cubed) 6 large garlic (cloves) 1 tsp vinegar ((apple cider vinegar)) 5 to 6 red chilies ( kashmiri (seeds removed)) 1 tsp sugar salt ( as needed) 1 tbsp oil ½ tsp cumin (or 1 small strand of mace) ½ cup onions (chopped ) coriander leaves ( or celery as needed for garnish) 1 tsp soya sauce (naturally brewed - optional) ,vegetarian,spicy,-1,Indo-chinese
Sweet corn soup recipe | How to make sweet corn soup,"1½ cups sweet corn (kernels (fresh, frozen, any)) ½ cup sweet corn ((optional, refer notes)) 3 sprigs spring onions ((fine chopped, separate greens & whites)) ¼ to ⅓ cup carrots ((finely chopped)) ¼ cup French beans ((4 to 6 finely chopped)) 3 to 3½ cups water (or stock) 1 tablespoon oil (or (butter)) ½ to ¾ tablespoon garlic (minced) ½ to ¾ tablespoon ginger (minced - optional) 1 small green chili ((deseeded & chopped, optional)) 1½ tablespoon corn starch ((corn flour, refer notes)) ½ teaspoon sugar ⅓ teaspoon salt ((adjust to taste)) ¼ teaspoon crushed pepper 1 teaspoon vinegar ((optional)) ",vegetarian,spicy,-1,Indo-chinese
Chicken lollipop recipe | How to make chicken lollipop,½ kg chicken (drummettes (or 1 lb)) oil (as needed for frying) 1 ¼ tablespoon Ginger garlic paste or mince (or ½ tsp each of powder) ¼ to ½ red chili powder (or paprika (adjust) or red chili sauce) ½ teaspoon any spice powder (or garam masala ) 1/8 teaspoon salt 4 tablespoon cornstarch ((white corn flour) or (2 tbsp rice flour)) 1 small onion (finely chopped) ¾ tablespoon ginger (minced) ¾ tablespoon garlic (minced) 1 teaspoon soya sauce 1 teaspoon vinegar 1 tablespoon red chili sauce (or red chilli paste or any hot sauce) 1 teaspoon sugar ¼ teaspoon salt ½ cup water 2 tablespoon chopped celery or spring onions ,non vegetarian,spicy,-1,Indo-chinese
Veg roll recipe (chapati roll),"1 cup atta (heaped, / whole wheat flour) salt ( as needed (optional)) 1 tsp oil 1/3 water (warm ) 1.5 tbsp olive oil 1 to 2 garlic cloves ( finely chopped) 2 to 3 cups cabbage (shredded (drained completely)) 1 cup carrots (shredded) 1 cup bell peppers 1 chili (slit ( skip if making for kids)) 1/4 tsp pepper ( coarsely crushed) salt ( as needed) 0.5 tsp vinegar 1 tsp soya sauce ( (organic or naturally brewed, skip for kids)) salt ( very little) Garlic sauce ( or tomato sauce as needed) ",vegetarian,spicy,-1,Indo-chinese
Paneer manchurian recipe,"200 grams paneer ((Indian cottage cheese)) ¼ cup all-purpose flour ((maida) (prefer organic flour)) 3 tbsps corn flour ( (corn starch or rice flour)) ¼ tsp Salt ½ tsp red chilli powder ((optional) replace with pepper powder) Water (as needed to make batter) Oil ( for frying) 1 tbsp oil (olive or sesame oil) ½ to ¾ tbsp garlic (minced ) ½ to ¾ tbsp ginger (minced ) ¼ cup spring onion ( whites chopped) ¼ to ½ cup capsicum (chopped or bell pepper) 1 tsp corn flour ((corn starch or arrowroot powder)) ½ cup water ((you may need little more, use as needed)) 1 ½ tbsps soya sauce ((use naturally brewed or organic, I used kikkoman)) 2 tbsps tomato sauce ((I used homemade sauce)) ¾ to 1 tsp sugar ½ to ¾ tsp black pepper ½ to ¾ tsp vinegar ((use only if needed to give a mild tang)) Salt ( as needed (use only if needed, I used about ¼ tsp)) 2 tbsps Spring onion ( greens) ",vegetarian,spicy,-1,Indo-chinese
Soya chunks manchurian,"¾ cup soya chunks 1 tbsp ginger garlic paste ½ to ¾ tsp red chili powder ( (less spicy variety)) ¼ tsp pepper powder ( (optional)) 2 tbsp corn flour ( or corn starch or just wheat flour) Salt ( to taste) Oil ( for frying) 1 tbsp oil 1 tbsp garlic ( chopped finely) ½ tbsp ginger ( chopped finely) ¼ cup spring onions ( or regular onion finely chopped) ¼ cup capsicum (/ bell pepper, fine chopped ) 1 tsp soya sauce ( (prefer organic or naturally brewed)) 1 tbsp chili sauce ( (prefer without MSG)) ½ to ¾ tbsp tomato sauce ( (prefer without MSG)) 1 tsp vinegar ( (prefer organic vinegar or apple cider vinegar)) ½ tsp sugar ( (optional, use if your sauce isn’t sweet)) ¼ to ½ tsp red chili powder ( (optional, for color)) ¾ tsp corn flour ( or corn starch) ½ cup water Salt ( if needed (may not need)) ¼ tsp pepper ( crushed coarsely) spring onion greens (Few , for garnish) ",vegetarian,spicy,-1,Indo-chinese
Chilli potato recipe | How to make chilli potato | Chilli aloo,3 medium potatoes (or aloo (about 250 grams)) 2 tbsp corn flour ((or corn starch or rice flour or organic all-purpose flour)) ¼ tsp red chilli powder (or paprika powder) salt (as needed) 1/3 cup oil (or as needed) 1 tbsp oil 1½ tbsp garlic (chopped) 1 medium onion (chopped or sliced (or 2 sprigs spring onions chopped)) ¾ cup capsicum (or bell peppers diced) 1 green chili (deseeded) ½ tbsp soya sauce ((naturally brewed)) 1 tbsp red chilli sauce ½ to ¾ tsp red chili powder (or paprika or red chilli paste (optional)) ½ to ¾ tsp vinegar ((prefer apple cider vinegar)) Salt ( as needed) ,vegetarian,spicy,-1,Indo-chinese
Singapore fried rice,"1 cup rice (, long grain, (cook to keep the rice grainy)) 1 tbsp garlic ( chopped finely) 2 tbsp olive ( or sesame oil) 1/8 tsp pepper ( crushed) ½ cup spring onions ( or leeks) ½ cup bell peppers ( (red, green and yellow)) ¼ cup carrots ( coarsely shredded) 1 green chilies ( slit or chopped) salt ( as needed) ½ tbsp vinegar 2 tbsp hot red chilli sauce ( or peri peri sauce) 1 tbsp Light Soya sauce 1 tbsp chili garlic sauce ",vegetarian,spicy,-1,Indo-chinese
Egg fried rice,"3 cups cooked rice ((or 1 cup uncooked rice)) 1 to 1½ tablespoon organic soya sauce ((adjust to taste) (or tamari)) 1½ teaspoon rice vinegar ((optional, adjust to taste)) 1 tablespoon chopped garlic ((2 cloves)) ¼ teaspoon crushed black pepper ¼ teaspoon salt ((Or as required)) 2 tablespoons oil ((Peanut or any other)) 3 to 4 stalks spring onions (chopped, (green and whites separated)) 3 eggs (or 2 large ) 1 to 1½ tablespoons schezwan sauce (or 1 teaspoon any hot sauce (optional)) ½ cup carrot ((chopped, 1 small carrot)) ½ cup bell peppers ((julienned or diced)) ½ cup cabbage (shredded (or peas or sweet corn)) ",non vegetarian,spicy,-1,Indo-chinese
Chicken manchurian,"250 grams chicken breast (boneless, (cubed or minced) ) ½ egg (white (1 egg white for ½ kg chicken)) 1/8 tsp pepper (coarsely crushed ) 1 tsp soya sauce ((Prefer naturally brewed)) 2 pinches chili powder ((optional, for color)) 2 tbsp corn starch ((white corn flour)) 1 ½ tbsp all-purpose flour (or maida (or rice flour)) 1 tsp ginger garlic paste (or minced) salt (little) oil (as needed for frying) 1 tbsp garlic (chopped finely) ½ tbsp ginger (chopped finely) 1 medium onion (chopped finely or 2 tbsps spring onion whites) 1 tbsp soya sauce ((use more for intense flavor)) 2 tbsp red chili sauce 2 tbsp tomato sauce (optional) 1 tsp vinegar ((add more if needed)) 1 cup water ( or chicken stock) 2 tsp corn starch ((white corn flour) (3 tsps for gravy)) 3 tbsp water (to mix with flour) salt (little ) ½ to 1 tsp sugar ¾ cup capsicum ( or bell peppers cubed) 2 tbsps scallions (or spring onions greens) ",non vegetarian,spicy,-1,Indo-chinese
Chicken fried rice,3 cups cooked rice ((or ½ cup uncooked rice)) salt (as needed) 1 tablespoon garlic (chopped) 1 tablespoon soya sauce (organic (adjust to taste)) ¼ teaspoon crushed pepper ((or pepper)) 2 tablespoon oil 1 to 2 green chilies ((optional) or any hot sauce as desired) 2 sprigs scallions or spring onions (or 1 small onion (greens & whites separated)) ¼ to ½ cup bell peppers (chopped) 150 grams chicken (chopped to bite size) 1 egg (or ¾ tbsp corn starch or brine (refer notes)) ½ teaspoon soya sauce 1 large pinch salt 1 large pinch crushed pepper ((or powder)) ,non vegetarian,spicy,-1,Indo-chinese
Sweet corn rice recipe | Sweet corn fried rice,"1 cup rice (uncooked or 3 cups cooked rice) 2 cups water ( or as needed to cook rice) 1½ tablespoon olive oil (or butter as needed) 2 garlic cloves ( minced) 1 medium onion (medium, or spring onions few sliced thinly) 1 to 2 green chili (slit (optional)) 1 cup sweet corn ((frozen or boiled)) ¾ cup capsicum (chopped ) 2 sprigs herbs ((mint/celery/coriander) chopped) ¼ teaspoon pepper powder ( as needed) ",vegetarian,spicy,-1,Indo-chinese
Mushroom manchurian,"200 grams button mushrooms ((1 & ¼ cup sliced)) ¼ cup all-purpose flour ((or wheat flour )) 3 tablespoons white corn flour (( corn starch)) ½ teaspoon black pepper powder ½ teaspoon red chilli powder ((optional)) ¼ teaspoon salt ¼ cup water ( (more to adjust the consistency)) Oil ( for frying) 1 tablespoon oil ((any)) ½ to ¾ tablespoon garlic ( (minced)) ½ to ¾ tablespoon ginger ( (minced)) ¼ cup spring onion ( whites, chopped ) ¼ to ½ cup capsicum (chopped / bell pepper) 1 teaspoon corn flour ((corn starch or arrowroot powder)) ½ cup water ( (you may need little more, use as needed)) 1 ½ tablespoons soya sauce ((use naturally brewed or organic)) 2 tablespoons tomato sauce (or ketchup) ¾ to 1 teaspoon sugar ½ to ¾ teaspoon vinegar ( (optional, if needed)) salt ( as needed (use only if needed)) 2 tablespoons Spring onion greens ",vegetarian,spicy,-1,Indo-chinese
soya chunks fried rice recipe,"1 cup rice (long grain ) ¼ to 1/3 cup soya ( chunks or granules) 1 tbsp soya sauce ( (can increase by ¼ tsp.)) capsicum ( / bell peppers (green, red any), Few juliennes) 1 to 2 stalks spring onions ( (green and white separated)) 1 handful Green peas ( (optional)) Carrots (few juliennes) 1 tsp vinegar 1 tsp garlic ( minced) 1/8 tsp pepper powder 2 tbsps Olive oil ( or sesame oil) 1 star anise ( / star flower / chakri phool, small ) 1 strand mace ( / javitri) salt ( as needed) ",vegetarian,spicy,-1,Indo-chinese
Schezwan chicken,250 grams chicken (or ½ lb cubed boneless ) 1 egg white ((refer notes on brine)) ¼ teaspoon salt ¼ teaspoon crushed pepper 1 teaspoon soya sauce ((chose naturally brewed)) 3 tablespoon Corn starch (or (white corn flour)) ¼ cup oil (or as needed for frying or grilling) 1 tablespoon sesame oil (or any) 2 to 4 dried red chilies ((refer notes)) 1 teaspoon Sichuan peppercorn (ground (refer notes)) 1 teaspoon garlic (chopped) 1 teaspoon ginger (chopped) 2 to 3 sprigs spring onions or scallions ((greens & whites separated)) 1 tablespoon soya sauce ((naturally brewed)) 1 tablespoon rice vinegar 2 tablespoon red chilli paste or 1 tablespoon chilli powder (or 15 red chilies (notes)) 1 tablespoon sugar ½ teaspoon Salt ((adjust to taste)) ¼ to ½ teaspoon ground pepper (or pepper powder) ,non vegetarian,spicy,-1,Indo-chinese
Chilli garlic noodles,"2 cakes noodles ( or 2 servings (150 grams)) 4 large garlic cloves ((1½ tbsp chopped finely)) ¾ to 1 tablespoon red chili flakes ((or 3 to 5 red chilies, less spicy kind)) 2 tablespoon oil ((divided, sesame or olive oil)) ½ teaspoon sugar 1 tablespoon soya sauce 1 tablespoon chilli sauce (or any hot sauce (optional)) 1 ½ teaspoon vinegar ((white or apple cider)) ¼ to ½ teaspoon salt ((adjust to taste)) 1 medium carrot (½ to ¾ cup chopped or sliced) ½ cup bell pepper ((capsicum) sliced or chopped) 2 sprigs spring onions ((greens & whites separated)) ",vegetarian,spicy,-1,Indo-chinese
Gobi manchurian recipe,"250 grams cauliflower (florets (gobi cleaned)) ½ cup all-purpose flour ((maida, prefer organic or at least unbleached)) ¼ cup cornstarch ((white corn flour or yellow corn flour)) ½ to 1 teaspoon red chilli powder (or paste (less spicy variety) (optional)) ¼ teaspoon black pepper (crushed or ground) ¼ teaspoon salt ((adjust to taste)) ½ cup water ((more if needed)) Oil (for deep frying as needed) 1½ tablespoons oil ((for sauce)) 1 tablespoon garlic (finely chopped) ½ tablespoon ginger (finely chopped) 1 green chili (chopped (optional)) ⅓ cup onions (or spring onions finely chopped ) ¼ cup bell pepper ((capsicum chopped finely) (optional)) 1 tablespoon soya sauce ((organic or naturally brewed)(or tamari)) 2 to 3 tablespoon Red Chilli sauce ((or 2 tsps hot sauce, adjust to taste)) 1 to 2 tablespoon tomato ketchup ((optional, use if using hot sauce)) ½ teaspoon Red chili powder ((optional) (less spicy variety)) ½ tablespoon rice vinegar ((I used apple cider vinegar)) 1 teaspoon sugar ((adjust to taste)) salt (as needed) 3 to 4 tablespoons water ½ to ¾ teaspoon black pepper (crushed or ground) ⅛ teaspoon salt ((adjust to taste)) 2 tablespoons spring onion greens (chopped for garnish) ",vegetarian,spicy,-1,Indo-chinese
Chilli mushroom recipe,"1 cup button mushrooms ((cleaned and quartered)) ½ cup bell pepper (/ capsicum cubed) ⅓ cup spring onions ((3 stalks)) 1 green chili ((slit and remove seeds)) 1 tablespoon garlic (, chopped, 2 to 3 cloves) 1 to 1½ tablespoon olive oil (or peanut oil or any) 1 tablespoon soya sauce (or tamari (adjust to taste)) 1½ to 2 tablespoons chili sauce ((adjust to taste)) ¾ to 1 tablespoon tomato ketchup (or tomato sauce (adjust to taste)) ¼ to ½ teaspoon sugar ((optional)) ¼ teaspoon black pepper ((crushed)) 2 to 3 tablespoons water ",vegetarian,spicy,-1,Indo-chinese
Chilli chicken,"¼ cup Oil (or more for deep frying) 250 grams chicken (boneless cubes (½ lb)) 1 ½ teaspoon red chilli sauce ((sweet & spicy, less spicy kind)) 1 ½ teaspoon soya sauce ((naturally brewed)) ¼ teaspoon pepper powder ((crushed pepper)) 2 to 3 tablespoons cornstarch ((white corn flour)) 1½ to 2 tablespoons all-purpose flour ((maida) (optional)) ¼ teaspoon red chili powder ((optional) or paprika or red chilli paste) 1/8 teaspoon Salt (or as needed) 1 egg white (use only as needed) (or 2 tbsps water (refer notes)) 1 tablespoon soya sauce ((naturally brewed)) 2 tablespoons red chilli sauce ((adjust to taste) (sweet and spicy)) 2 tablespoons tomato ketchup ½ teaspoon red chilli powder ((optional) or paprika or red chili paste) ¼ teaspoon pepper powder ¾ to 1 teaspoon vinegar ((any or apple cider)) ½ to 1 teaspoon sugar 2 to 3 tablespoons water 1½ tbsp oil 1 medium onion (thinly sliced or cubed) 1 tablespoon garlic (fine chopped) ¼ to ½ cup bell pepper ((capsicum) - cubed ) 1 to 2 green chilies (slit and deseeded (optional)) 1 sprig spring onion (or scallions chopped (optional)) 1 to 3 tablespoon Spring onion (greens for garnish) ",non vegetarian,spicy,-1,Indo-chinese
Veg noodles recipe (Vegetable noodles),"2 packs noodles ((2 servings (150 to 180 grams))) ¼ teaspoon salt ((adjust to taste)) 2 to 3 tablespoons olive oil ((or sesame oil)) 1 tablespoon garlic (chopped) 1 to 3 green chili peppers (slit (adjust to taste)) 1 small onion (sliced or 3 tbsp spring onions (optional)) 2 to 3 cups mixed veggies julienned ((cabbage, carrots, bell pepper, green beans)) ½ teaspoon black pepper (crushed (powder)) 1 tablespoon soya sauce ((or star anise & 1 strand mace)) 1 teaspoon vinegar ((or lemon juice)) 1 to 2 teaspoon hot sauce ((like chilli sauce or sriracha)) ",vegetarian,spicy,-1,Indo-chinese
Mushroom fried rice recipe | Mushroom rice recipe,1 tbsp oil (sesame or olive) 2 cloves garlic ( chopped) 1 sprig spring onions (or half small onion sliced) ½ cup bell peppers (or capsicum sliced) ¾ to 1 cup mushrooms (sliced ) 1 green chili (slit (optional)) ¾ tsp soya sauce ((adjust to suit your taste) (or any other sauce)) ¾ tsp vinegar ((adjust to suit your taste)) Pepper powder (as needed) Salt (as needed) 1 cup rice (cooked (or half cup raw rice)) ,vegetarian,spicy,-1,Indo-chinese
Chilli fish,"¼ cup Oil ( for shallow frying or more deep frying) 250 gms fish fillet 1 ½ tbsps corn starch ((corn flour)) 1 ½ tbsps all-purpose flour ⅛ tsp salt ((sauce already has salt, so add less)) ¾ tsp soya sauce ¼ tsp ground black pepper ((pepper powder)) 1 tsp ginger paste ((or crushed) (optional)) 1 tsp garlic paste ((or crushed) (optional)) 3 garlic cloves (chopped or minced) 2 stalks spring onions (or 1 medium onion sliced) ¼ cup green bell pepper ( cubed) ¼ cup red bell pepper ( cubed) 1 tbsp soya sauce 1 tsp vinegar 1 to 2 tbsp red chili sauce ((or any hot sauce)) 2 tbsp water 1 tsp sugar ¾ tsp corn starch ((corn flour) (optional)) ",vegetarian,spicy,-1,Indo-chinese
Chicken soup recipe | How to make Indian chicken soup,"250 gms chicken ( (bone-in chicken)) 1 carrot ½ cup Sweet corn 1 potato (optional) 1 cup any vegetables of your choice ((optional) (cauliflower, celery,cabbage)) 2 tbsp Lemon juice ( (helps in fighting flu and cold)) 1 tbsp ginger (chopped finely (optional)) 1 tbsp garlic (chopped finely) 1 tsp ghee (or oil or butter) 1 small bay leaf 4 pepper corn 2 inch cinnamon piece ",non vegetarian,spicy,-1,Indo-chinese
Schezwan paneer recipe | Indo chinese spicy schezwan paneer recipe,2 tbsp red chili paste ( (or 7 to 8 red chilies)) Hot water ( to soak chilies) 3 to 4 tbsps corn flour 3 to 4 tbsps all purpose flour ( or maida (organic)) salt ( as needed) ¼ tsp pepper water ( as needed to make the batter) 200 grams paneer oil ( for deep frying) 1 to 1½ tbsp oil ( for seasoning) ¾ tbsp. garlic ( chopped finely) ½ tbsp. ginger ( chopped finely) ½ tsp schezwan pepper (or 3 to 4 crushed (optional)) 2 tbsps spring onion whites (chopped ) 2 to 3 tbsps celery (chopped (optional)) salt ( as needed) ¾ to 1 tsp sugar ¾ tbsp soya sauce ½ to ¾ tbsp vinegar ( ( or tomato sauce)) 4 tbsps water ¼ cup capsicum ( (optional)) ½ to ¾ cup water 1 tsp corn flour ( or corn starch or arrow root powder) ,vegetarian,spicy,-1,Indo-chinese
Veg fried rice recipe,"1 cup Rice ((uncooked or 3 cups cooked like basmati, jasmine)) 1 tablespoon Garlic (chopped) 2 tablespoons oil ((peanut, sunflower or avocado)) 1 tablespoon Soya sauce ((or tamari, adjust to taste)) 1 teaspoon Vinegar ((rice vinegar or apple cider)) Salt (as needed (I use ¼ teaspoon)) ½ teaspoon Black pepper (coarsely crushed) ¼ to ½ cup Carrots (chopped finely) ¼ cup Bell peppers ((capsicum) chopped finely) ¼ cup French beans ((4 to 5 green beans, chopped finely)) ¼ cup Green onions ((scallions/spring onions, 4 stalks, fine chopped)) ¼ cup Cabbage ((optional, or ¾ cup mushrooms sliced )) 1 green chili (slit (optional, for heat)) ",vegetarian,spicy,-1,Indo-chinese
Manchow Soup,"½ to 2 tablespoons oil ¾ tablespoon ginger ((fine chopped)) ¾ tablespoon garlic ((fine chopped)) 1 green chilli ((fine chopped, deseeded for low heat)) ¼ cup onions 2 to 3 stalks spring onions ((fine chopped, greens & white separated)) ⅓ cup carrot ((1 small, fine chopped)) ¾ to 1 cup cabbage ((fine shredded)) 2 to 3 tablespoons French beans ((4 to 5 green beans, fine chopped)) 2 to 3 tablespoons bell peppers ((capsicum)) 3 to 4 mushrooms ((optional, fine chopped)) 1 to 2 tablespoons coriander stems ((or celery stalks, fine chopped)) 2 tablespoons coriander leaves ((fine chopped)) ½ to ¾ teaspoon salt ((adjust to taste)) 3 tablespoons organic soya sauce (or tamari) ½ teaspoon pepper ((crushed white or black pepper)) 1½ tablespoon cornstarch ((more for a thicker soup)) 1 to 3 teaspoons rice vinegar ((or apple vinegar)) 150 grams noodles ((preferably hakka noodles)) 1 cup oil ((to fry or 1 tbsp for air frying)) 2 to 2½ tablespoons corn starch ((white corn flour)) ",vegetarian,spicy,-1,Indo-chinese
Schezwan noodles,"2 to 3 cakes noodles ((or 2 serving size, 160 to 180 grams)) 2 to 3 tablespoons olive oil (or sesame oil) 2 dried red chilies (broken) 1 ¼ cup mixed vegetables ( chopped ( carrots, capsicum,beans, mushrooms)) 2 sprigs spring onions ( ( separate greens and whites)) 1½ tablespoons red chili paste (or 15 to 20 red chillies or red chilli powder) 1 to 1½ tablespoon tomato sauce ((optional)) ¾ tablespoon garlic (chopped finely) ¾ tablespoon ginger ( chopped finely) 1 onion (medium sized , chopped finely) ½ teaspoon salt ((adjust as needed)) 1 teaspoon sugar 1 tablespoon soya sauce ( (naturally brewed)) 1 teaspoon vinegar ¼ to ½ teaspoon sichuan pepper (powder (or ground black pepper)) 2 tablespoon celery (chopped, optional) ",vegetarian,spicy,-1,Indo-chinese
Garlic mushrooms,"1½ cup mushrooms (chopped or sliced) ½ cup onions (finely chopped ) ½ teaspoon cumin (or jeera or 1 strand of mace / javitri) 1 to 2 tablespoon oil ((prefer olive oil or butte)) 5 large garlic (cloves or minced(if using small, use more)) 5 dried red chilies (or chilli powder as needed (less spicy variety)) ¾ tablespoon Vinegar ((apple cider vinegar or lemon juice)) ½ to 1 teaspoon sugar ((prefer organic) or jaggery) salt ( to taste) 1 to 2 tablespoon water ¼ teaspoon red chili powder (optional (less spicy one for color)) 1 small Onion rings ( or slices) 2 tablespoon coriander leaves (chopped) ",vegetarian,spicy,-1,Indo-chinese
Vegetable soup,½ tablespoon oil ((or butter)) ½ tablespoon garlic (fine chopped or minced) ¼ to ½ tablespoon ginger (fine chopped or minced) 2 sprigs spring onions (greens (or scallions)) 2 sprigs spring onion (whites (or scallions)) ¼ cup carrots (fine chopped) ¼ cup peas ¼ cup sweet corn ¼ cup french beans ½ cup cabbage (fine chopped) 2½ cups water (or vegetable stock) 1 tablespoon corn starch ((or 3 tbsp oats powder or 1 tbsp arrowroot powder) (optional) (refer notes)) ¼ cup water ((to mix with flour)) ¼ teaspoon salt ((adjust to taste)) ½ to 1 teaspoon sugar ((optional)) 1 teaspoon vinegar ((apple cider) or lemon juice) ¼ to ½ teaspoon red chilli flakes ¼ to ½ teaspoon pepper powder ((crushed pepper)) 1 small bay leaf (optional) ,vegetarian,spicy,-1,Indo-chinese
Clear soup with vegetables,1 large yellow onion ((avoid red onion)) 1 cup celery stalks (( you can also add more) chopped) 2 carrots (diced or cubed (can add more)) 10 french beans ((lesser if also fine) ) ½ cabbage (diced ) 1 to 2 stalks celery leaves or coriander leaves 1½ cup mushrooms (sliced (or ½ cup mixed veggies or broccoli )) 8 florets cauliflower ((optional)) 1 tsp garlic (chopped) 1 tsp ginger (chopped) 1 tbsp oil 1 stalk spring onion (greens or scallions) ½ tsp crushed pepper (or ground pepper) ,vegetarian,spicy,-1,Indo-chinese
Garlic chicken,"300 grams chicken (strips or boneless cubes) 4 tbsp Yogurt (/ dahi / curd (do not use sour yogurt)) Salt ( very little) 1 pinch pepper 2 tbsp Oil 1 sprig curry leaves ¼ tsp cumin 1 onions ( chopped finely) 5 red chilies (or 3/4 tsp red chilli powder) 5 garlic (cloves crushed) ¾ tbsp Vinegar ¼ tsp sugar ( (optional)) Salt to taste 15 to 30 ml Water ( (lesser, better) to make a paste) Coriander leaves ( few) Onion wedges ( or rings) Lemon ",non vegetarian,spicy,-1,Indo-chinese
Cabbage rice (Cabbage fried rice),½ cup rice ((uncooked)) 2 cups cabbage (chopped ) ¼ cup Green peas ((optional)) 2 green chilies ((deseeded & slit)) 1½ tbsp olive oil (or any oil) 2 to 3 cloves garlic (chopped finely) ½ to ¾ tsp rice vinegar ((or apple vinegar)) Salt ( as needed) ¼ tsp black pepper ((crushed)) 1 to 2 tsps soya sauce ((optional)) ,vegetarian,spicy,-1,Indo-chinese
Lemon chicken recipe | how to make lemon chicken recipe | chicken starter,"300 grams chicken (boneless cubes or breast) 1 ½ tbsp oil 1 tsp ginger paste 1 ½ to 2 tbsp lemon juice salt ( as needed) ¼ tsp lemon zest ( (optional)) ¾ tsp red chili powder 1/8 tsp turmeric ½ tbsp oil 1 tbsp ginger (chopped or minced ) ½ tbsp garlic 1 green chili ( slit) 1 onion (large , chopped) ½ tsp sugar 1 tsp cajun spice mix ( or garam masala) ½ tbsp soya sauce 1 Handful celery ( or mint or coriander leaves) ",non vegetarian,spicy,-1,Indo-chinese
Spring rolls recipe | How to make veg spring rolls,3 cups cabbage (shredded) 1 medium carrot (about ½ cup shredded) ¼ cup bell pepper (or capsicum julienned) 2 sprigs spring onions ((white & green separated)) 1 to 2 tsps olive oil 1 to 2 tsp soya sauce (or soy sauce) 1 tsp vinegar ¼ to ½ tsp pepper powder or crushed salt very little 1 cup cooked noodles (or half noodle cake (optional)) 6 spring roll wrappers (frozen) 1 cup oil ( for deep frying or 1 tbsp oil for baking) ,vegetarian,spicy,-1,Indo-chinese
Veg manchurian recipe,"1 ¼ cup cabbage (finely chopped) ½ cup carrot (grated (1 medium)) ¼ cup French beans ((finely chopped, can skip but adds flavor)) 2 tablespoons capsicum ( grated or minced) ¼ cup spring onions ( finely chopped) 3 tablespoons cornstarch ((white corn flour)) 3 tablespoons all-purpose flour ((maida) (prefer organic)) ¼ to ½ cup bread crumbs ((optional, for extra crisp, refer notes)) ¼ to ½ teaspoon pepper ( crushed) 1 teaspoon ginger garlic paste 2 pinches salt ((very little)) Oil (as needed for frying) 1½ tablespoons oil ¾ tablespoon garlic (finely chopped) ½ tablespoon ginger (finely chopped) ¼ cup spring onions ( finely chopped) ¼ cup bell peppers ((capsicum) finely chopped) 1 tablespoons soya sauce (or tamari) 2 tablespoons red chili sauce ((or any hot sauce, adjust to taste)) 1 tablespoon ketchup ((optional)) 1 teaspoon vinegar ( or as needed (or apple cider vinegar)) ¾ tablespoon cornstarch ( (white corn flour or arrowroot powder (1 tsp for dry)) ¼ cup water ( to dissolve cornstarch(2 tbsps for dry)) 1 cup water ( or veg stock for gravy (½ cup for dry)) salt ( as needed) 1 to 1 ½ teaspoon sugar ¼ to ½ teaspoon pepper (coarsely crushed) ½ to ¾ teaspoon red chili powder ( or 1 tsp red chili paste (optional, used for color)) 1 ½ tablespoons water ( to make chili paste) ",vegetarian,spicy,-1,Indo-chinese
